{"contract_id":"pm-credential-rotation-contract/1.0.0","schema":"pm-credential-rotation/1.0.0","commands":[{"command_id":"b23e4567-e89b-42d3-a456-426614174010","command_type":"rotate_device_credentials","not_before":"2026-08-13T20:07:00Z","expires_at":"2026-08-13T20:17:00Z","attempt":1,"idempotency_key":"credentials:prepare:e23e4567-e89b-42d3-a456-426614174013","required_firmware_capability":"credential_rotation_v1","payload":{"schema":"pm-credential-rotation/1.0.0","rotation_id":"e23e4567-e89b-42d3-a456-426614174013","device_secret_hex":"000102030405060708090a0b0c0d0e0f101112131415161718191a1b1c1d1e1f","credential_fingerprint":"630dcd2966c4336691125448bbb25b4ff412a49c732db2c8abc1b8581bd710dd","overlap_expires_at":"2026-08-13T20:17:00Z"}},{"command_id":"c23e4567-e89b-42d3-a456-426614174011","command_type":"rotate_device_credentials","not_before":"2026-08-13T20:08:00Z","expires_at":"2026-08-13T20:17:00Z","attempt":1,"idempotency_key":"credentials:commit:e23e4567-e89b-42d3-a456-426614174013","required_firmware_capability":"credential_rotation_v1","payload":{"schema":"pm-credential-rotation/1.0.0","rotation_id":"e23e4567-e89b-42d3-a456-426614174013","credential_fingerprint":"630dcd2966c4336691125448bbb25b4ff412a49c732db2c8abc1b8581bd710dd"}},{"command_id":"d23e4567-e89b-42d3-a456-426614174012","command_type":"rotate_device_credentials","not_before":"2026-08-13T20:08:00Z","expires_at":"2026-08-13T20:17:00Z","attempt":1,"idempotency_key":"credentials:cancel:e23e4567-e89b-42d3-a456-426614174013","required_firmware_capability":"credential_rotation_v1","payload":{"schema":"pm-credential-rotation/1.0.0","rotation_id":"e23e4567-e89b-42d3-a456-426614174013","cancelled":true}}],"results":[{"command_id":"b23e4567-e89b-42d3-a456-426614174010","state":"succeeded","progress_percent":100,"result_code":"ok","evidence":{"rotation_id":"e23e4567-e89b-42d3-a456-426614174013","credential_fingerprint":"630dcd2966c4336691125448bbb25b4ff412a49c732db2c8abc1b8581bd710dd","ready":true}},{"command_id":"c23e4567-e89b-42d3-a456-426614174011","state":"succeeded","progress_percent":100,"result_code":"ok","evidence":{"rotation_id":"e23e4567-e89b-42d3-a456-426614174013","credential_fingerprint":"630dcd2966c4336691125448bbb25b4ff412a49c732db2c8abc1b8581bd710dd","activated":true}},{"command_id":"d23e4567-e89b-42d3-a456-426614174012","state":"succeeded","progress_percent":100,"result_code":"ok","evidence":{"rotation_id":"e23e4567-e89b-42d3-a456-426614174013","cancelled":true}}],"authentication":{"prepare_command":"old_server_to_device","prepare_result":"old_device_to_server","commit_command":"old_server_to_device","commit_result":"new_device_to_server","cancel_command":"old_server_to_device","cancel_result":"old_device_to_server"},"recovery":{"prepared_candidate":"persist_and_resume","untrusted_time":"dormant_fail_closed","commit_intent":"resume_activation","result_cleanup":"authenticated_result_ack_required"}}
